{
  "$schema": "../../agents.manifest.schema.json",
  "frameworkVersion": "3.0.0",
  "projectName": "MyApp",
  "platform": "Internal Business Application",
  "architecturePhilosophy": "Simple things should be simple, complex things should be possible.",
  "language": {
    "communication": "tr",
    "code": "en",
    "docs": "tr",
    "commits": "en"
  },
  "layers": {
    "technology": [
      "dotnet",
      "react",
      "sql-server",
      "testing"
    ],
    "domain": []
  },
  "technologyStack": {
    "backend": ".NET 9 Web API, EF Core 9, MediatR (CQRS)",
    "frontend": "React 19 + TypeScript 5.x + Vite 6, Ant Design 5, TanStack Query v5",
    "database": "SQL Server 2022",
    "auth": "ASP.NET Identity + JWT",
    "test": "xUnit, Vitest, Playwright",
    "observability": "Serilog + Seq"
  },
  "aliases": {
    "sef": "orchestrator",
    "backend": "tech-dotnet",
    "frontend": "tech-react",
    "db": "tech-sql-server",
    "qa": "tech-testing",
    "review": "code-quality",
    "mimari": "process-architecture",
    "analist": "process-analysis"
  },
  "performanceTargets": {
    "apiResponseP50Ms": 200,
    "apiResponseP95Ms": 500,
    "dbQueryP95Ms": 100,
    "frontendFcpSec": 2.5,
    "frontendBundleKb": 500
  },
  "sprintConfig": {
    "durationDays": 10,
    "capacityPercent": 80,
    "techDebtPercent": 10,
    "bufferPercent": 10,
    "pointScale": "fibonacci"
  }
}
